score,author,date,review
8,DaveOakenshield,"Jun 18, 2022","A great sequel, better than the original easily. Absolutely awesome. Excellent cinematography. Best film I've seen in years!"
8,Mail_031,"Jun 18, 2022","really solid movie, just slow at the start. Really enjoyable action and gain a relationship with all the characters!"
10,AshenWon,"Jun 18, 2022","This film is a combination of steroids, adrenaline, testosterone, endearing positivity and bottled nostalgia that gave feelings that I haven’t felt since childhood. I left the cinema feeling.. alive.

Tom Cruise is spectacular, both on and off screen."
10,ammaaya,"Jun 17, 2022","I don't even like action movies, but I'm rating this high simply for finally reminding audiences what action movies are SUPPOSED to be. Most of blockbuster movies churners lost recipes, but they did not. Good for them."
9,TangEng,"Jun 17, 2022","The movie is great fun and surpasses the original.
It's the movie of the year."
10,Azrael246,"Jun 17, 2022","Now this is the blockbuster movie I've waited years for. Great pacing, lots of action and drama, and an overall fun film that I would not hesitate to recommend to anyone."
9,bjmetacritic,"Jun 16, 2022","Just when you start thinking that Hollywood doesn't make them like they used to, along comes this. It was a breath of fresh air - just a good old-fashioned entertaining action movie. Story is simple, but effective. Effects are mostly practical which gives a nice weight to the action. Tom Cruise proves he's still got it, and other performances are good as well. It was well-worth the price of a theater ticket."
9,tritemonster292,"Jun 16, 2022",Really liked the plot in this movie. Tons of suspense and excitement... Definitely go see it!
10,jayjayjackob,"Jun 16, 2022","I recommend! I’m happy to watch a movie, which does not try to “shoot” at me some political or ideological content. Just love this movie!"
9,Dongodor,"Jun 16, 2022","Great movie, a real and good successor to the first movie and that’s a really good time I had"
9,Thwompthing,"Jun 15, 2022","Nostalgia = 100%

Action = 100%

Music = 100%

Acting = 90%

Story = who cares?

9/10"
10,mxs1438,"Jun 15, 2022","I saw this movie yesterday and I can't stop thinking about it. I thought the original Top Gun was a great movie and it was a big surprise that 35+ years later, a sequel was made.

The sequel is based on the original Top Gun and takes the movie to new levels that are astonishing in many different ways. Obviously, the action scenes are completely amazing. Beyond that, this is a movie very much about relationships. Relationships about teams and relationships focusing on 1-1 dynamics. Painful history with a lot of hope and suspense to see how it unfolds.

In the end, the most significant aspect of this movie is Tom Cruise’s performance. He truly inhabits the character Maverick. Tom Cruise is one of the best actors of the 20th and 21st century and he proves it again and again in this movie.

Hint: Watch/Re-watch the original Top Gun, then run out to see this movie."
9,barryburton,"Jun 15, 2022",Just a lot of fun with lots of nostalgic nods to the original. Highly recommended as an action film for some escapism.
1,dani3po,"Jun 15, 2022","Machines for war and an unexpressive main character. Also, the main theme is terrible."
10,watchoutch02,"Jun 15, 2022","Same as Kobra Kai! THIS is how you make a sequel! It's better than the original. Scenes from the first movie are replicated the perfect way and that is how you pass the torch to a younger generation. The movie honors the characters and that's exactly what I wanted. It brings out so many emotions I can't ****'s a rollercoaster in every way. At some point you think the movie is over, but it keeps going and it only gets better. The original score completes this amazing movie."
7,davemelbourne58,"Jun 14, 2022",Much better than expected. Certainly better than the first Top Gun.  My only real complaint was the love story w/Jennifer Connelly.  This is a movie made for the movie theater. I was entertained
9,theredsky,"Jun 14, 2022","Miles better than the original 1986 film and one of my favorite sequels of all time. God this film is just awesome. That’s the best way to describe it; awesome. The flying is awesome, the characters are awesome, the music is awesome, and the action is awesome. Tom Cruise’s dedication to making realistic action films with little to no visual effects has paid off incredibly well here. The flying scenes were filmed practically but they look amazing. Some of if not the best shot sequences of the year so far. I absolutely adore how they look and it’s amazing that the actors were able to act in those conditions. They all do a great job acting. Tom Cruise, Miles Teller, and Glen Powell are all standouts here and their respective characters and journeys were really well done and even compelling at points. Val Kilmer did a great job as well under his own personal circumstances. The film handles Kilmer’s medical condition and character incredibly respectfully. It’s a great handling of his character. The action here is awesome. It’s incredibly well thought out and intense. You could know or predict the outcome of a scene and you could still feel your heart beating out of your chest just because of how well done the action is. It’s genuinely some of the best action in a blockbuster that I’ve seen in a long time. The final action scene itself is probably my favorite action scene of the year. It’s absolutely amazing and so much better than the final fight in the original film because it’s actually set up. The music here from the original Top Gun composer, Lady Gaga, and Hans Zimmer is great! The soundtrack itself isn’t near as good as the original 86 film but it’s still great here. I can’t wait to see how Cruise breaks the mold with action again in the future. This is a must see from me for everyone. This film deserves to break $1 Billion at the box office so go see it now!"
10,asy815,"Jun 14, 2022","real good legacy sequel, definetly better than the first top gun movie, airborne action scenes like  never seen before"
10,Gamelore,"Jun 13, 2022","Count me shocked.  A movie about concrete and boats and gray metal, infused with such a well-crafted drama that it leaves me bawling for 15 minutes.  The movie truly was perfectly calculated to achieve an optimal climax.  It hit all the notes.  Extremely rarely does a movie get me deeply invested in the struggle; somehow, through character interactions, I totally invested.  And the struggle -- my god.  From so pathetically desperate, to pure win -- fantastic."
9,BeardedYoda,"Jun 13, 2022","As someone who hasn't even seen the first TOP GUN movie, only knowing a few story details, I can honestly say that TOP GUN: MAVERICK is a very enjoyable and very well done film. The movie is worth watching, even if you haven't seen the first film. This movie may not do anything ""new"", but it does a lot right. I definitely recommend checking this blockbuster out."
6,Gamer2077,"Jun 13, 2022","This movie teaches you two lessons.

1) It´s cool to use your motorbike with your jacket and no helmet. Go as fast as possible, you can do the f*k you want in America.

2) Kids, ""don´t think, just act"" that should be your motto in life. (yes, my review is pure sarcasm.)"
9,zaneycritic,"Jun 13, 2022","I would call this movie a theater only experience. I feel like watching this movie at home just wouldn’t be the same. That’s the only deducted point. This does the first movie justice, and goes beyond that."
8,Bottie,"Jun 13, 2022","Top Gun Maverick was a brilliant film, the story was well executed with a bit of thrill and a nice ending"
9,IndieLove23,"Jun 13, 2022","Watched it in a cinema with a super wide screen and Dolby Atmos and WOW... quite the experience. A very summer blockbuster-type film that many can enjoy watching. Happy to say, I enjoyed it very much."
9,Nargapo,"Jun 13, 2022","One of the best cinema experience in years. Watch it in IMAX, you will not regret it!"
10,Fitness100,"Jun 13, 2022","Excellent movie and keep hearing how great it was and didn't disappoint me at all. Tom Cruise's acting is better than ever and he still looks great , still young looking. Not a dull moment and had my sitting on the edge and bite my nails"
7,Homurakagari,"Jun 12, 2022","It's pretty good, definitely an improvement on the original in a number of ways."
3,rowlandcloud,"Jun 12, 2022","What a piece of garbage. Looks good in a cinema, but the story line is so unbelievably bad and predictable. Lost some brain cells whilst watching. The original Top Gun wasn't that good to begin with, but this was the cheapest re-make Tom Cruise could come up with."
9,skykappah,"Jun 12, 2022","This is a classic old school blockbuster in every respect. You know it's a good movie when it clocks in at over 2 hours and it seems shorter, hardly a boring moment. I prefer it over the original in that the story flows much better because the first one was bogged down with the 80's need for cringey love themes.

One of the few films where the sequel is better than the first.
It's the perfect end and hopefully they leave it at that."
9,MYReviewNAME,"Jun 12, 2022","A true successor to the original movie. Capturing the nostalgia from the original Top Gun: Maverick doesn't just try to follow in the footsteps, but instead the movie becomes a new classic. A rare sequel that doesn't always exist in movie franchises."
10,yoshi594,"Jun 12, 2022","""Phil Collins - In the Air Tonight"" the movie! amazing build up and an even more amazing pay off.

Fun, Funny, Action, and a few heart tug scenes, delivered and some move in Maverick; everything needed in a blockbuster.

Only gripe of the was the length...wasn't long enough!"
8,Ilovepandas9,"Jun 12, 2022","Good ol American fun! Was it predictable, yes. Was it fun, yes. Was it cheesy, hell yes, however the movie had everything I could ask for from a sequel to a bro movie that I never saw. The film does a great job of catching in those without knowledge of the first, so don’t let not seeing the first stop you from seeing this fun filled adventure."
10,pjthedj79331,"Jun 11, 2022",Bad ass!!!! This movie was awesome! Finally a movie without leftist woke crap! I love this movie and will watch it again!
9,Optickone,"Jun 11, 2022","A beautiful reminder of what a major blockbuster use to be all about.

The lack of forced politics and the agenda was such a genuine breath of fresh air."
10,JarpeeMD,"Jun 10, 2022","Incredible. One of the best action movies ever. So so good. Music, acting, pacing, everything is just awesome."
10,dawnerd,"Jun 10, 2022",Oh man was this such a fun and enjoyable movie. Many moments where I was tensing up. The filmography is so stunning.
6,ballhawg,"Jun 10, 2022",Predictable plot yet a few fun plane scenes makes it worth a view at least once.
5,Davidsco27,"Jun 10, 2022","The 2nd half kind of saves it, kind of, but this was a HUGE disappointment, especially after all the gushing reviews.  Maybe Cruise is working his Scientology crap on them.  Some of the WORST directing, acting and script I have ever seen, and I'm a huge movie buff.  LOVE the original, it was fun, this is almost an embarrassment. I've never seen a poor Jon Hamm performance until this, and Cruise is obviously in cruise mode lately as he hasn't made a decent film since MI3 and is now just riding the mediocrity train to the bank.  I have really gotten sick of these check the box films now too that ensure every race, creed, nationality and sex is equally represented for no artistic reason other than to appeal to everyone.  I have NO idea what the woman pilot was doing there, and she could've easily been replaced by a mannequin.  Connolly was boring and wooden.  The flight scenes ranged from meh to good, the music was bland, poorly used, and NOWHERE as emotion stirring as the original. The Val Kilmer treatment was a saving grace, but come on viewers and critics. There's no way you're keeping it real, or maybe you saw a different film. Maybe after a long theater absence you've lowered your standards and expectations and are just to eager for a great theater experience.  I get that, we all need that fun again. For me, this just wasn't it"
9,ThinkLiveLife,"Jun 10, 2022",Really solid movie. This has to be one of the rare times the sequel is actually better than the original. It really shows that they did not cheap out and go full CGI with the small details like seeing the pilots genuinely react to the maneuvers they pull that stand out.
8,elisejj,"Jun 10, 2022","Loved the original Top Gun movie, even named my dog Maverick after the movie but thought this one fell a little short. Tom Cruise movies usually has a lot of action and not a ton of talking which was the same case with this movie. That wasn't a big problem for me, but it was slow in some parts. I personally would have liked to get to know the pilots he was training more or had Maverick build relationships with them more to add more depth or shake it up in parts more to keep the audience's attention. Still would recommend you see, but I would get the free ticket from Applebee's first or wait to watch it when it comes out on TV."
9,devgre,"Jun 10, 2022",Maverick was an incredible experience and an exercise in storytelling format that has long since been abandoned by Hollywood.
10,DarthLeon,"Jun 10, 2022","Aliens, Empire Strikes Back, Godfather 2... Sequels that are on par or better than their original. Top Gun: Maverick deserves that distinction in spades. A roller coaster ride from beginning to end. The aerial scenes are beyond breathtaking and the romance and Bromances are very believable. Tom Cruise proves he is the Last Action Hero! A+"
9,Nuajo33,"Jun 10, 2022","Gros travail sur ce film, les scènes d'action sont incroyable, et Tom Cruise est au top.
j'attendais avec impatience cette suite et je ne suis pas déçu. Ce n'est pas une pale copie du premier film, de l'humour, des émotions, de la nostalgie et de l'action sont au rdv.
Foncez."
9,giancarretta,"Jun 9, 2022","Finally a very good movie that doesn’t try to push you the woke liberal agenda. Great action and storyline that doesn't copy from the past, however still respecting the fan base."
10,robomartion,"Jun 9, 2022",It's really visceral edge of your seat no nonsense entertainment. Its biggest downfall is also its greatest and most stand-out unique quality and that is it never delves into the area of fiction like a James Bond film and is realism all the way. It feels almost like a real life account of what it would be like to be in an elite air force. The practical effects. It also sets the bar on how to do a reboot and I'm sure will make a lot of people think about signing up to the Navy. It is a true American film and gets the full 10 for not labelling any particular country as the enemy as well as for minimal drama with no unnecessary bickering manufactured division between the crew. Its all about team work.
10,Polisorbato,"Jun 9, 2022",[SPOILER ALERT: This review contains spoilers.]
10,MusashiMoto,"Jun 9, 2022","One of the best openings to a movie I have seen in many years.  Excellent pace and expertly directed action sequences.  They just don't make films like this anymore, and I got a little sad watching it in the theater thinking ""I will probably never see another movie like this again.""  The majority of writers in Hollywood today are untalented weak minded hacks that are not capable of doing anything close.  The hero arc for Maverick is well crafted and the production had immense respect for the character.  This is a far cry from the majority of sequels and reboots made lately which seek to deconstruct and tear down beloved characters from the past in order to build up pathetic new characters that usually act like narcissists.  I will go see this movie again, and I haven't said that about a big budget film for a long time."
10,RicardoDirani,"Jun 9, 2022",[SPOILER ALERT: This review contains spoilers.]
9,scb47,"Jun 9, 2022","One of the most enjoyable movies in recent memory. Top Gun Maverick pays appropriate homage to the first film while managing to bridge the 40-year gap with style. Exciting, moving, **** has everything a person would want from a movie."
2,onefjef,"Jun 9, 2022","I haven't seen such a lazy piece of mainstream garbage since the adaptation of the board game Battleship. They basically just remade the first movie, but way worse. The only redeeming thing about the film is the hot airplane action, but even that becomes boring after a while. Just because it's a mainstream film doesn't mean it can't be creative or different in some way, Top Gun Maverick feels like it was phoned in. You can do better, Hollywood, I know you can."
10,FatzJim,"Jun 9, 2022","Great movie. Well written, shot, and a great acting. This is reminiscent of older well done movies that didn't need to preach to you or tell you what everything was and how you should feel about it. Great sequel. Also, pays homage to the past."
9,emirbud,"Jun 9, 2022","Great fun. Leave behind unnecessary criticism and skepticism, bring suspension of disbelief, and you'll have a good time. Far superior to part one. This movie is free of politics, it has very little political correctness, so it is pretty much free of so much annoying stuff that plagues today's movies. Definitely worth the trip to cinema."
9,LordGanon,"Jun 9, 2022","Very good sequel to the first one, no political statments, no hate, very good action scenes."
9,CTAN,"Jun 8, 2022","Even better than its 1st movie, love it!! If you haven't watch this, highly recommended."
9,joeyabuki,"Jun 8, 2022","Great movie. Excellent movie. It's perfect.

After 36 years (1986) Tom Cruise returns with the second part and THEY THROWED THE HOUSE OUT THE WINDOW. What genius. He has the perfect action and characters that make you yearn for the 80s."
10,zyler,"Jun 8, 2022","Gave me an 80s vibe while being modern, very rarely do I get a movie that gives me that sort've nostalgic feeling but with modern cinematography. Enjoyed the characters and humor. One of my favorite new movies in recent years."
10,rutin21,"Jun 8, 2022","A must see movies 2022 so far i think, i hope this movie could be nominated for oscar best actor and best picture."
9,dharma,"Jun 8, 2022","After many decades, Tom Cruise returns to the blockbuster that put his name on the map, Top Gun. this film joined an elite group of sequels that are better than the original.  I can even say that it is one of the best Action film of the last decade. Amazing set pieces, cinematography and sound editing. Sequences filmed live, with the actors actually flying these fighter **** dropping to say the least.  This is a film that need to be seen in an IMAX screen, or the very least any kind of cinema.  However, all these razzle dazzle will be for naught without the human characters and that is what Top Gun excels in all front.  This may be the Tom Cruise show but is also an ensemble piece, with all actors in their A game.  One of the best film of 2022 so far."
9,ReViEwSs,"Jun 8, 2022",Better than the original by quite a bit while still retaining everything fans could want from the original. Well worth the price of admission.
10,Securion,"Jun 8, 2022","Just perfect in every way. Completely devoid of wokeness. An amazing film.
--------------------------------------------------------------------------"
10,RyanRetroGamer7,"Jun 8, 2022","This has got to be the best movie I have ever seen in theaters! I will even say I prefer it over any of the marvel movies.  And yes, I do love marvel, so that’s really saying something.  Go watch this movie! It honestly surpasses the original!"
8,Experiment626,"Jun 8, 2022","Lots of fan service, but done in a good way.  It does rehash the first movie, but it felt fresh.  Liked how they evolved Maverick's character.  I do think the ending was changed.  The last 15 to 20 minutes felt tacked on and out of place.  But that didn't ruin my overall enjoyment of the movie.  Do recommend.  If you have access to see it in a 4DX theater (motion based), and don't get motion sickness, I highly recommend giving it a chance."
10,DALLLY,"Jun 7, 2022","Amazing movie. I havent seen the first one. But man, it was really good. I Love the details of the movie."
10,Blokin,"Jun 7, 2022","Uncompromising entertainment. I can’t even remember when I saw a movie or a show last time, where I wasn’t also given an uncomfortable amount of social studies lecture. Maverick is a breath of fresh air in a time when audiences are not allowed to just switch off from the depressing reality that is life, and immerse themselves in an exciting story. This movie is delivers flawlessly what it promises, what you’d expect. Plainly speaking, its a perfect movie for what it is."
9,ItsMainman,"Jun 7, 2022",This is a real Hollywood movie with all the charisma and charm of a classic blockbuster. The score is exciting and emotional and the pacing kept me on the edge of my seat afraid to blink in case I might miss something. As someone who never really loved the original film I’ve found a new respect for it as this sequel is a masterclass in cinema.
10,Arkham26,"Jun 7, 2022","Exceptional in a good way, this is totally new to the industry. Years of delay due to covid, but still the best movie yet and definitely for more years to come"
9,drlowdon,"Jun 7, 2022","Thirty years since the events of the original film, Captain Pete ""Maverick"" Mitchell is serving as a U.S. Navy test pilot when he is sent to act as an instructor for a group of elite pilots at the TOPGUN academy.

Top Gun Maverick is undoubtedly one of the best action movies of the last decade with absolutely staggering flight scenes that just have to be seen at the cinema. Even the plot, which is pretty much as predictable as it gets, somehow still manages to prove suitably emotional. Just a great movie all round."
10,Metzerck,"Jun 7, 2022","Amazing movie, i don´t remember any aircraft´s movies with this level of realism, also the characters are very well interpreted, the script is well writen, and also, the music of this movie is just fantastic... if i could put more than 10, i would."
9,Pikapalooza,"Jun 7, 2022","I really enjoyed the movie - it stayed true to the characters, didn't interject too many modern trends, and had a ton of practical effects vs cgi heavy stuff.  The story was simple and not overly complicated.  Made me feel like I was a kid again watching the first one."
9,Pbork,"Jun 7, 2022",Fresh yet nostalgic . Tom doesnt age . Big budget movie with superb results.
9,Deviltherobot,"Jun 7, 2022",A great sequel that is better than the original. I am going to see it again in IMAX
9,dave_a,"Jun 7, 2022","I really liked this sequel. Yes it has its cringe moments but in a way that also improves the movie. Looking at 2022 and the movies that have been release so far this is really one to watch. This was also awesome to watch in 4DX so if you have the opportunity, definitely go experience that.

Rating it a 9 because it's awesome but some small things could be improved."
10,MaxMad2099,"Jun 7, 2022","All I wanted in a movie. Action, love, epic moments, good music.... No political or moral trials ... Just fun.
Great tom cruise, he looks 20 years less!"
10,Telsatall,"Jun 6, 2022",Such a great story. I thought going to the theaters on week 2 would be a good time to see the movie. We couldn’t get decent sheets in the theaters. It’s been probably a decade since I haven’t been able to get good seats on week 2 on a film.
10,iVincent,"Jun 6, 2022","Go and watch the movie in the cinema now. The best movie experience ever.
Them actions scenes were unbelieveable and the sound is so good. Great acting from everyone. Best sequel ever."
8,intruder313,"Jun 6, 2022","It does stray into 'too silly' territory towards the end, but for the most part it's an excellent sequel that remains more.....grounded."
8,Chaos_Luke,"Jun 6, 2022","hab Teil 1 nicht gesehen, aber war top und werde das nachholen... Den Rest fülle ich mit Spam, um das Zeichenlimit zu umgehen. Gibt aber einen Daumen hoch von mir."
9,Mattyice,"Jun 6, 2022","Top Gun: Maverick ends up being one of those rare sequels that surpasses the original classic in almost every way. Adding depth and gravitas to the story, as well as gorgeous cinematography and stunt sequences, while retaining some of the cheesiness, humor, and charm that made the original an 80s icon. Tom Cruise is obviously the stand out of the cast with a fantastic and shockingly emotional performance, but the rest of the cast is great as well and the new pilots all have their own charm, although I did find Miles Teller's Rooster to be a bit miscast. The only cons I really have for the film are the fact that it's a bit too heavy on exposition for both Maverick and Penny's, as well as Maverick and Rooster's, relationships. It's depiction of the ""enemy"", which is clearly Russian/Chinese yet isn't stated as much or shown, is also odd, but studios want to make money and not get this movie banned from those countries, so it's understandable albeit clunky. Otherwise, Top Gun Maverick is one heck of a ride and a very worthy trip to the cinema."
10,levorato,"Jun 6, 2022","Outstanding. Some breath tanking scenes, it was really a pleasure to watch."
9,McGamor,"Jun 6, 2022",An excellent movie that shows what can be accomplished when there is no woke propaganda added. Its a very patriotic and faithful sequel to the original.
