score,author,date,review
9,cruel_frames,"Jun 6, 2022","I was blown away! This is what filmmaking in 2022 should look like! Visually I haven't seen anything like this. Sure, CGI was improved in the last years, but nothing beats the real thing. They actually put the actors in real F18 jets and you can feel this! I am still gushing aboout this film! I hope it smashes the box office and shows to hollywood what people want! I am tired of politics, the M-SHE-U and the recent 100% green screen productions."
10,Grendizer,"Jun 6, 2022","One of the best and intense cinema experiences I witnessed. Very enjoyable movie and truly mate to experience on a big screen. This movie feels and looks like an 80s movie (in a good way). They captured the atmosphere perfectly. It won't win any prices for acting or script (just normal neither bad nor good), but I think this movie isn't about that. It was a joy to watch it and will see it today for a second time. A good 80s action flick brought into our time."
9,Jones76,"Jun 6, 2022",[SPOILER ALERT: This review contains spoilers.]
10,Ruegrong,"Jun 5, 2022","A Sequel to the 800's original that actually surpassed expectations. The Movie has everything you can ask for in a film. The authenticity that is displayed on screen is the best I have ever seen, with the actors in actual cockpit. I would love to see more films share the same dedication and hard work put into their films. Top Gun Maverick has set the bar pretty high"
7,Nimin,"Jun 5, 2022","I liked this movie because of the flight and action scenes. However, it's totally forgettable."
9,JeremyDeb,"Jun 5, 2022","Awesome movie. Loved it more than the first. Amazing flying sequences. Story was somewhat believable, if a little predictable. Nostalgia was great too."
8,PhelipeRomano,"Jun 5, 2022",rubbishish this website: do I have now to write a review everytime I wnat to just vote rating? pain in the *ss
10,JoshuaJ_Joestar,"Jun 5, 2022","Great writing! Amazing acting! I cannot think of a single thing wrong with this movie no matter how hard I try. I didn't even see the original the film, yet I felt like I knew Mavrick for years. I don't know what else to say, Awesome film!"
10,T4p0utxfr35h,"Jun 5, 2022","One of the best movies I've seen in a long time. Tom cruise is showing hollywood how to make the best A+ movies. There wasn't a dull moment the entire movie. All seat gripping, cheering, and and anxiety moments."
9,level52,"Jun 5, 2022",Uzun yıllar sonra izlediğim en iyi film.Gerçekten tebrik ederim emeği geçen herkesi.Devamının gelmesini çok isterim.Şimdiki filmler çok vasat çıkıyor artık.Böyle projeler daha da değerlenmiş oldu bence.Teşekkürler...
9,RayneGokce,"Jun 5, 2022","The movie is excellent, you will definitely not regret it. The movie starts off well, with a little bit of classic comedy. On the other hand, they reflected the emotion well, the film director makes you feel the emotion while watching it. The shooting quality is good, the actors are well acted, the setting is nice and the subject is well chosen. It's hard to find a good action and drama movie these days and Top Gun is in my opinion a great movie that makes up for the current lack of action and drama. There should be more movies like this."
9,Drakan,"Jun 5, 2022","Old-school, no CGI effects, no LBGT politics hard selling us 'The Message', etc. Just a great summer movie & popcorn."
10,Taylo226,"Jun 4, 2022",The movie is fantastic. It is devoid of the current woke nonsense Hollywood puts out these days. also in theatres is definitely the way to watch it.
10,xDWx,"Jun 4, 2022","Totally fun and not at all woke!  It starts out a little slow, but the second half where they get to the actual combat is awesome.  Using real jets makes a HUGE difference.  Everything feels real not like all the fake green screened CGI you get with most movies.  I left the movie theater loving this, can't wait to see it again!"
10,Justin22,"Jun 4, 2022","Awesome cinematography, great script and awesome acting. Best film I’ve seen in a while"
9,Halonut24,"Jun 4, 2022","It's a real treat in this day in age to have a sequel to a beloved classic film that actually fulfils the role of, well, a sequel. If you haven't seen it, or are debating seeing it, debate no longer. This is must-watch stuff right here. Go see it immediately.

To be entirely truthful, I fully expected this film to suffer from the same pitfalls all of these sequel/remakes do in today's age; to spit in the faces of the original, and re-make it in their own twisted image. Re-write characters to fit a new narrative. Break down their legacy into something unrecognizable. Like what Disney did to Star Wars over the past decade.
To my utter amazement, it never did. Not even a little bit. Every second of this film was totally respectful to it's 1986 predecessor. Almost all action seen is practical. Those F-18's were real F-18's, flown by real people, filmed with real cameras, and it's a sight to behold. The sound design beautifully translates the incredible power these machines possess. It's characters remain untarnished from revisionism. Maverick is still the same Maverick we knew all those years ago. The new characters are written realistically, with care and diligence. Our hero's struggles are approached with dignity and respect. Ulterior motives, personal politics, all absent from the film. With all of it wrapped in just the perfect amount of nostalgia tastefully sprinkled throughout the 2 hour runtime. Enough to harken back to it's roots, and tug on a few heart-strings, but it never dwells on it. Something this authentic and genuine needs to be openly praised and cherished. This is what we should expect sequels, and to that extent action films in general, to be. What a wonderful surprise."
9,Jedimiller1,"Jun 4, 2022","Very enjoyable, it doesn't suffer from throwbacks to the original, it tries to be its own movie and succeed. Also no woke garbage agendas."
10,rAMZA,"Jun 4, 2022","One of the best movies i have seen in a long time, lot of nostalagia and got even a little tears in my eyes. I was probably 6-8 years old whe i did se the first one, been a long time to wait for this ""second mission"" :)"
9,ScotterMonkey,"Jun 3, 2022","Nostalgic, touching, fun, exciting. Simple but exactly what I wanted and expected. Only thing I'd add is more music during the flying."
9,brennenmorrow,"Jun 3, 2022","While I wasn't the biggest fan of the original film back in 1986, the sequel was incredible! The dedication that all of these actors had for this movie was unbelievable. While it's a very predictable film and I don't exactly consider it to be groundbreaking, it's a perfect sequel and ending to an iconic original. I consider this to be an improvement upon the original in many ways."
9,SpectreCMD,"Jun 3, 2022",An amazing sequel that takes the original and actually improves upon it! I went in and actually got more of a movie than I expected. Worth the ticket price.
10,DoctorJemima,"Jun 3, 2022","Fantastic movie. Great pacing, story, action sequences, and did not lean too much on nostalgia. Best way to watch is definitely in theaters or with a great sound system."
9,Reviewer917,"Jun 3, 2022",Absolutely great movie.  This is how movies should be made.  No social justice nonsense.  Just good acting and a good story.  It is must see.
6,icotzabb,"Jun 3, 2022",Tom Cruise is fearless in his quest to clear the planet earth in this melodramatic predictable time killer.
9,Gemsicle,"Jun 3, 2022",[SPOILER ALERT: This review contains spoilers.]
9,m3thod22,"Jun 3, 2022",tom cruise is the best. i hope he lives forever cos no one else makes his sorta movies anymore.
10,roadrunnerz45,"Jun 2, 2022","36 years in the making. Who would have thought it would ever come out. What a spectacle. Plot is questionable but the action is edge of the seat stuff, the opening scene and the test course is hair raising. Cruise makes it happen, even after all these decades he is spectacular. There's a few telling quotes in there about time running out, but fortunately for us it was indeed, not today. Appreciate this once in a generation actor while you can and feel the need for speed."
9,jameshowlett89,"Jun 2, 2022","this is what you want from your entertainment.... no bs no forced politics, just fun content to watch. the action was amazing with either none or very little cgi(i couldn't find any) and one of the only movies in recent memory that actually kept me on the edge of my seat at the theater."
10,mrniceguy44,"Jun 2, 2022","The plot is as flat as, wel you can think of something. But the great cinematografie, tension, 80s vibe and acting makes 100% up for it. And real life jet scenes make all the difference from all to common blue screen."
10,vlalalad,"Jun 2, 2022","Just a great overall movie. Does not take itself too serious, but it made people in the audience cry. Great music, nostalgic feeling, incredible action scenes! Worth every penny, too bad there are so few movies of this level nowadays."
9,SaintOzz,"Jun 2, 2022","Its as good as ppl are saying in fact IMHO its one of the best sequels ive seen
in many many years.  I left the theater just happy its that kind of feel
good movie!"
9,HowToBen,"Jun 2, 2022","Top Gun: Maverick is a phenomenal example of modern-age cinematography. The 3-year delay for this movie is justified by the final product we are fortunate to see. It is far too common that Sequels for Standalone films are produced purely for 'nostalgia money' but Top Gun: Maverick is an anomaly of modern-age filmmaking. My respect for the cast and crew was further enhanced by the knowledge that they used practical effects and put the actors in actual Military-grade fighter aircraft. Too often are films quickly made and rushed with the use of CGI and it is incredibly refreshing to see a movie created with sheer passion and commitment to creating this sequel. I was not born to witness the original, but my Mother and her Friend's enjoyment in the cinema proved to me that this movie whilst bringing a new plot, could also pay homage to the feeling of the original.

The story is told in a manner that is neither boring nor underplayed, and the return of iconic actors in a realistic way further enhances the respect given to the original. Although there are elements of the plot that are bland, the feeling of the movie suits the narrative. The actors all deserve huge credit, not only for their performance but also for their dedication with flight-training to partake in their roles to the best of their capabilities.

This is a great movie in a time of over-saturation and CGI, I am so refreshed to see a movie that does not rely on the use of CGI and soleless storytelling, more like this, please."
10,Barti7i,"Jun 2, 2022","Just created account to rate this movie...Absolutely stunning, simply epic sequel. I'm speechless."
10,mickrussom,"Jun 2, 2022","A rare sequel - this one is actually better than the original. If this was a stand alone movie it would be a seven/eight of ten. But as a sequel navigating the modern outrage mobs and other cantankerous spoilers and wreckers waiting in the wings to bring anything good down this thing is a solid ten. Tom Cruise doesn't look almost 60, he is in unreal shape for any age, but the work and dieting he must put in to look like this at 59 is nothing short of amazing. There is less cheese than was in the first movie, the music is great, and to see these people grunting and huffing while pulling real g-force maneuvers in real airplanes is so great. Tom Cruise had to take a huge amount of abuse to make this a reality - you can see the actors in planes sweating and suffering tunnel vision and black outs and redouts. One must have a healthy  respect for Tom Cruise for being one of the very very few in hollyweird that actually cares enough about his craft to put in the work. I hope this kicks off a new wave of serious remakes that can even outshine the original if done right and I hope this kicks off a new wave of movies that skip the idiotic computer generated trash and get back to practical effects like this movie. This is basically an 80's movie done right - take all the good music and good looking people, reduce the cheese and come up with an engaging multi-faceted multi-layered plot that develops emotion and take it to eleven on a scale of ten."
7,beefalo16,"Jun 2, 2022","Overall a good movie and worth a watch for anyone who enjoyed the first one. Definitely some fan service, but movie also holds up on its own.

Main complaints holding it back from a higher rating:
1) Really needed a large dogfight scene, feels like so much wasted potential here. We didn't get to see all the pilots in action and a lot of the training seemed like it was irrelevant.
2) Zero attempt to flesh out the enemy/mission, was extremely contrived. I get that the focus was on Maverick but this still felt a bit lazy.
3) Some of the dialog/acting from the new pilots was pretty bad."
8,TVJerry,"Jun 2, 2022","More than 30 years later, Tom Cruise returns as the daring, renegade aviator from his original hit. His character is sent to teach a group of young pilots who are charged with an especially challenging mission. If you remember the original, there are lots of parallel scenes and relationships in this one, including a brief appearance by Val Kilmer. Basically, this film boils down to macho posturing peppered with flight footage and moments of romance. While the plot is predictable at every turn, the solid performances and tight editing help make it appealing. However, it's the spectacular aerial scenes that makes the movie memorable. It's a solid popcorn flick that's an appropriate follow up."
10,rattley,"Jun 2, 2022","Outstanding. And I don’t write that lightly. This film really delivers. I wanted to watch it again immediately. Solid but simple story line.
Great cast. Amazing flight sequences. Action.  Humour. Sadness. Love. Just a great blockbuster movie . To be honest, I’ve missed this sort of cinematic experience. This all being lead by the unbelievable , incredible Tom Cruise. Who truly puts himself on the line for the film goers. A true artist. One of the last real classic film stars. This film has all that you need. Will it win Oscars? Probably not. But will you get your money worth? Absolutely. In my humble opinion, This is such a better movie than the first, even though I still love that movie. I was gripped within the first opening minutes. My heart did not stop beating at high rates in anticipation of every moment. I was not disappointed. It’s been a long long time since I’ve experienced that rush and enjoyment watching a film.  I recommend anyone to go see this film. You will not leave disappointed. ( I hope). ️️️️️"
8,digitalkoimoi,"Jun 2, 2022","What’s Good: It’s not just action and visually shocking stunts that overpower the narrative, but an emotional story and a touching conflict that manages to grab your attention.

What’s Bad: The women in this universe are strong but don’t get enough to do. They support the men and that cannot be the only thing they get to do.

Loo Break: Please no, Tom Cruise is returning after decades and you cannot really miss even a single scene. Plus it’s in theatres, there will be intermission in India at least.

Watch or Not?: Miles Teller in an interview told me there is almost no green screen involved, if you won’t acknowledge this effort, who will?

Check out our full review in ****"
8,AJ_13,"Jun 1, 2022","Top Gun: Maverick gave me even more than I was expecting. A vibrant, immersive action film, beautifully shot and flawlessly crafted. It goes from less to more, hitting the high notes during action scenes and managing to get emotional. When it comes to performances, Miles Teller is great in it and the rest of the cast is fine. I don't have enough adjectives to describe my admiration for Tom Cruise."
9,alejandro970,"Jun 1, 2022","As incredible as it sounds, it has the charisma of the previous one, and increased, despite the 35-year gap between them. The flavor of nostalgia is always present, with a script with many surprises and action scenes that must be seen on a giant screen."
10,Wihglah,"Jun 1, 2022","This amazing sequel is an unapologetic homage to both the original and the US Navy. There are several call backs to the first movie and a great new storyline. The minor characters can be a little one dimensional, but there are twists and turns top the plot that I did not anticipate. Tom Cruise is still a proper movie star here, Miles Teller and Jennifer Connelly were also fantastic."
10,danielago,"Jun 1, 2022","Filme sensacional! Sequências de ação extremamente bem feitas e imersivas, acho que é o filme de combate aéreo mais imersivo que já vi. História bem envolvente também e te deixa tenso nas horas certas! Visual maravilhoso!"
9,luckystriker,"Jun 1, 2022","Top Gun Maverick had no right to be as good as it was. Crafted with love and care, the movie had a strong emotional core coupld to some of the most visceral and exciting action sequences ever put on film. A type of movie no longer made by Hollywood, this is a film that shines on the big screen. Go and watch it!"
10,Vini_lamberti,"Jun 1, 2022",[SPOILER ALERT: This review contains spoilers.]
10,saimariejohnson,"May 31, 2022","I absolutely loved everything about this film - it was such an incredible story and the delivery by each actor was so heartfelt and passionate. The action sequences and even the lovely scene with Val; it was just laced together in a perfectly spectacular way and I teared up, and cheered up and loved every second of the ride. 10/10 HIGHLY recommend! My new all-time favorite Cruise film, hands down."
10,Quack4321,"May 31, 2022","This movie took me by surprise. It was one of the most exciting movies I’d ever seen. Awesome story, awesome screenplay, awesome everything."
10,beno1998,"May 31, 2022",This was an absolutely fantastic film. A great sequel to the first one. The story was perfectly written. Thank you very much. I already saw it twice.
8,MarcDoyle,"May 31, 2022","Better than I thought it would be.  Most importantly, I didn't want it to be a pure nostalgia play like the first of the new Star Wars movies (essentially remaking the first film). I enjoyed the next-gen cast, and the flying action is incredible. Absolutely something that needs to be seen on the big screen."
8,AJWrites,"May 31, 2022",[SPOILER ALERT: This review contains spoilers.]
9,zanygreek,"May 31, 2022","This film just gives me what I want. No BS, two hours fly by and they respect the first film which doesnt happen a lot these days. They dont taker liberties trying to get a cool young audience, they play to fans of the first film. About time."
9,HamishIII,"May 31, 2022",Excellent popcorn flick made for the fans.  Excellent characterization and Easter Eggs along with homages to the previous movie.  I saw the original in the theater and glad Tom held out for this to be in the theater and a must see on a big screen with great sound.  My kids also enjoyed the movie and one had only just seen Top Gun recently and the other not at all.  Glad there was no hidden agenda.  Great to see all the practical filming aspects vs green screen.   I highly recommend this.
10,Proko8,"May 31, 2022","Top Gun: Maverick is the best movie i have seen in years. 10/10 movie of the year, and its not even close.

Phenomenal cinematography, audio, music, story, acting, everything was amazing."
7,mrc_brn,"May 31, 2022","In the moment, while watching, the scenes manage to exhilarate and evoke testosterone infused manly man feelings throughout. After the movie is done, and the story sinks in, one can only smirk at the absolute nonsense that you just swallowed, hook, line and sinker. Tom Cruise is Ethan Hunt and Superman in a flight suit, it should have been called Mission (Im)Possible 8. But the dog fight scenes and all. that. machismo. are fun to watch while it lasts.."
7,Mauro_Lanari,"May 31, 2022","(Mauro Lanari)
Sly had already tried it with the trilogy ""The Expendables"", an economic but not critical success: a dozen years ago the hangover of the planetary reviewers was aimed at crossmedialization (or globalization) and panned as ""nostalgia operation"" everything what was distant from the new trend. Instead Bruckheimer returns to produce not silly TV series but a blockbuster, calling back in their roles as film stars actors sold off to the fictions of the streaming platforms: Val Kilmer, Jennifer Connelly, Ed Harris. Not a masterpiece but not even the caricature of a blockbuster: fortunately it is not Bergman who plays chess with death, but it is the identical concept adapted for the masses (""Time is your worst enemy""). And it is also metacinematographic: the military mission to be accomplished is feasible only by downgrading the paraphernalia and relying on the additional capabilities of the human factor so as to circumvent the digital supertechnology set up to fight something that on paper should no longer exist. This reminds the historic lose wars because of an arsenal suitable for pitched battles and not for guerrilla warfare. Havin' learned the lesson, passed the period of famine, victory is guaranteed. Ps: just to be clear, I have no memory of a single frame of Tony Scott's film."
10,samulijunnila,"May 31, 2022",**** amazing!!! One of the best movies i have ever seen in a theatre. Also the filming needed for this movie is exceptionary.
10,Dragonight,"May 30, 2022",Absolutely amazing movie. Best movie I have ever seen. 100/10 would watch again
10,jeffw38,"May 30, 2022","Incredible storyline, pacing, characters, soundtrack flight sequences…. just go …."
8,barbiesuperfan,"May 30, 2022","Um, it was well paced. It was good, if you watched the last one (because the last one maverick had a lot of call back a lot) so if you haven't seen the last one, hahahah, it's not doesn't make sense. Um, it was thrilling, it really captivated you, um, it was also sad at some parts. Um, what else... Overall, it was very captivating, um, and a good watch, but I would reccomend watching the first one before watching this one so it makes sense, but you don't have to watch the last one because it explains some bits, but it does help dramatically if you um watch the last one. - Blake"
7,Schlafrockman,"May 30, 2022","It's a showcase of brilliance in every aspect of cinematography, definitely worth seeing... I quite liked how they put the emotional weight of the story into the relation with Goose Jr.  But on the other hand... it's just an action flick full of cliches, leaning toward sci-fi so, I cannot quite understand the overwhelming ratings."
0,Fearls1,"May 30, 2022","This movie is purely for movie theater profits. It will fade into obscurity before winter, as it has nothing the original brought to the screen. Music is terrible, the hero is completely unbelievable 60 year old man, that is somehow better than the best in the world cadets. Moral of this movie, is go see little Tom Cruise show you his degrading body. Disgusting."
2,Kzix,"May 30, 2022","Positive: fighter jets scenes
Negative: everything else from every character, scenario, script, ending"
9,Daniel_Endure,"May 30, 2022",A heck of a blockbuster that takes expert cinematography to the skies. Exceeds the first in every way. See it.
10,cmhh,"May 29, 2022",Siiiiiiiiiiiiiiiiiiiiiiiiiiiiiiiiiiiiiiiiiiiiiiiiiiiiiiiiiiiiiiiiiiiiiiiiiiick.
10,digbiggly,"May 29, 2022",The BEST movie in years!! I can't think of a single thing I didn't like about it! Congrats Tom and Paramount.
