score,author,date,review
10,gaelucho_bdx,"Jul 9, 2025",un incroyable film meilleur que le 1 tu ne vois pas le temps passé et de la tension à tout moment
8,Miyod,"Jun 7, 2025","the sequel is better than the original, the main character has become smarter, it was nice to see his rival from the first part, and the young actors did a good job."
9,CRM03,"May 19, 2025",9.5........................................................................
10,Akoltuniuk,"Apr 28, 2025",The 10/10 review holds strong. I was excited to see how this was upon rewatch and I was not disappointed in the slightest.
10,Movieliefhebber,"Jan 6, 2025",top gun 2 was a masterpiece really a beautiful film worthy of an oscar this film one of the very best films ever made i think this film is pure class
10,Doomsdaylama,"Oct 25, 2024","The best movie ever, I loved the sound design and overall the cinematography"
10,Moviefan98,"Oct 13, 2024",Top Gun: Maverick is one I am completely lost for words to describe the Maverick experience as it was just magnificent as I was blown away from it.
7,drqshadow,"Oct 2, 2024","Given the influence of rose-tinted nostalgia and the remarkable staying power of the original, Tom Cruise and company could be forgiven for just running everything back and cashing it in for the Top Gun sequel. And, as far as the plot is concerned, that’s pretty much what they’ve done. Sure, we’ll see a few mild distinctions, plus a shift in perspective (Cruise certainly isn’t going to play a student pilot, nor is he apt to give up that top billing), but the bones are essentially the same. Cocky kids in an elite dogfight academy are ordered to set aside their differences and accomplish an impossible mission in hostile airspace. Adrenaline, testosterone and pheromones run wild. We even get a reprisal of the YouTube-famous beach volleyball scene. It’s a fitting tribute and a worthy successor, modernized to suit today’s high-end home theater equipment, but not half as gloriously ‘80s-tastic as the first film.

Where Maverick really soars (if you’ll pardon the awful pun) is in a technical sense. This was evidently an area of special concern for the filmmakers, and they deserve special credit for the accomplishment. All that work to embed an array of super-resolution cameras into the pilot’s seat has paid off: this is a major level-up moment, on par with the very best IMAX showpieces. Paired with a persistent soundtrack of strained grunts and rapid breathing, the footage does a fantastic job of conveying the intense physical effort that’s required to maintain control of a fighter jet, while also portraying the stunning vistas and dizzying speeds of afterburner combat. More than just special effects for a film, Maverick’s vision of airborne cinema borders on a true life experience. As a film, it’s a light-hearted flex of the bicep, designed to pluck memory threads and evoke warm feelings established by the original. Worthwhile, especially for long-term fans, but not particularly special. The cockpit scenes, though, especially that blood-rushing one-cut takeoff from the aircraft carrier, will stick with me for a long while."
5,Samuelfung,"Aug 23, 2024","《Top Gun: Maverick》（2022）, excellent movie,very entertaining with good storyline, good action & good fight, good production, good sound effect, good cinematography & special effect,1️⃣1️⃣0️⃣% or A+"
7,PersianParadise,"Jul 29, 2024",[SPOILER ALERT: This review contains spoilers.]
7,Squinja,"Jul 26, 2024",[SPOILER ALERT: This review contains spoilers.]
9,Mrington,"May 30, 2024","A complete masterpiece if you like action movies, the fact that the second is better than the first one is a rare thing,"
10,przybylop,"May 29, 2024","This is one of the rare perfect movies I've seen. It's not overwhelmingly profound or epic, but every line of dialogue, every casting choice, and every shot serves their purpose perfectly. No wasted movements or scenes. It can be used to teach ""How to build a satisfying blockbuster"" class for years to come. It goes big, it gets weighty enough with existential issues, and it has enough twist and turns to make you question if the aging protagonist is supposed to survive this. 

Cruise is at his best as the equal parts vulnerable and cocky Maverick. His instant chemistry with Connelly makes you believe the latter was really in the original/first Top Gun. Supporting roles are hit with expert precision.

Ultimately, Top Gun: Maverick doesn't try to be anything that it isn't. It reaches all of its goals (action, star-driven, thoughtful, nostalgic, fun, suspense) effortlessly."
9,raymond0229,"May 29, 2024","An epic movie, no need to explain anything, period!!!! Great acting, production and effects. Can't wait to see what's next."
9,Samuelsonuel,"May 26, 2024","Great movie, about pilots. It is really close between this one and the original but I would say the original one clears by the length of Kenny Pickett’s hand."
0,WokeNonsense,"Apr 27, 2024","Woke nonsense. The nominal villains -- the enemy fighter pilots -- are barely represented on the screen. The actual villains are all white, male Armed Forces higher-ups: the Vice Admiral (Jon Hamm), the Admiral (Ed Harris), etc. This movie hates the US military."
10,Borutogabi,"Apr 27, 2024","Um filme maravilhoso, ótima experiência, sabe criar momentos de ação e deixar você maluco querendo saber o que vai acontecer UMA OBRA PRIMA"
10,CoolSun,"Dec 26, 2023","Perfect.  Holistically sound on all gears.  Tom Cruise Brilliant!  Producer, co-director, and actor.  Perfect timing."
8,valeriiege,"Oct 30, 2023","Top Gun: Maverick is surely better than its successor. Prequels after long years are dangerous because most of them are forcibly pushed stories. But Maverick, connects all the dots successfully and offers great action. And, of course, nostalgia always wins."
10,tactanon,"Sep 14, 2023","Disney and hollywood needs to take some notes. Reviving/continuing old movies means you need to reference and nod to the classics before it, which TG:Mav did and continued to extend the story. The story was smart not to mix politics (didn't mention where the enemies are from). That's why the film did extremely well and got paid billions. Pay the fan's service, and they'll pay you in box office sales. Simple math."
7,o_rety,"Aug 27, 2023","Stealing a line from another reviewer: I liked the parts with airplanes :). Don't get me wrong, the rest was not particularly bad. But, the emotional parts were overly melodramatic (and made it look padded with too much filler), and you better don't engage your rational qualities at some plot points (especially during the last segment) - you won't see much sense there. This movie was totally in tune with it's hero - a dying breed. A proper blockbuster focusing on delivering fun and action."
10,XMarkX,"Aug 20, 2023",Tom Cruise is very dedicated in all aspects of filmmaking. Nowadays it is rare to find films that focus on uniting people with good stories. Excellent film.
10,KelvinSelimor,"Aug 17, 2023","Top Gun: Maverick. Wind in your hair. A perfect example of what a cult movie sequel should be. For the intro, immediately +1 to the movie, a light opening under (You've Been Called Back to Top Gun)"" and then a transition in which planes start flying under ""Danger Zone""... It's just a berry on the cake. Continued on, my opinion turned out even better. On the one hand, this is understandable, technically everything has become much cooler and shooting from the cockpit and how the planes fly is one of the best things that is in ""Top Gun: Maverick"". The plot is also quite interesting, but it is precisely its task that rises before the pilots. And of course, a separate applause for Tom Cruise, who continues to amaze with his stunts and control of real combat fighters."
9,RefinedInsights,"Aug 11, 2023","A great movie, and a fantastic sequel, it restored a sense of wonder to the movie-watching experience."
5,BananaFloat,"Aug 9, 2023","Because of the horrible screenwriting that goes on for half the show, I can only give it 5/10. Because the last half of the movie is awesome (action, not horrible poorly written drama), I give it 5/10 stars."
9,Tom09,"Jul 21, 2023",It's nice to see this movie franchise to come back  since 1987 when the first on came out long waited and worth the wait
8,AgentLvi,"Jul 21, 2023","Great movie. The story is decent. The scoring is great, visual is really amazing, the voice & sound is also amazing"
10,DCosloff1999,"Jul 19, 2023",A remake sequel that respects what came before and passed the torch to the new characters to be part of a legacy done right.
9,DarkwingSchmuck,"Jul 8, 2023","Superior in every way to the original film, Top Gun: Maverick is a thrilling action movie with pinpoint direction.  The practical stunts are the star of the show, but this film also puts on a clinic as to how to properly establish stakes."
9,cris699,"Jul 6, 2023","A sequel that nobody wanted but that we all need.
Another deserved success for Tom Cruise."
8,yooples54,"Jun 30, 2023","Awesome movie with stellar action and plot. the acting was great and it had lots of ups and downs. the only reason im not giving it anything higher than 8 is because it didn't completely blow me out of the water, but it was an overall good movie, that left me feeling satisfied."
10,extrashotlatte,"Jun 11, 2023","For a sequel no one knew they wanted, asked for, or expected, Top Gun: Maverick was one of the best (if not the best) film of 2022, which reminds us why Tom Cruise is one of the few legitimate superstars of our time.

By now most people would have seen this film, which takes place 30 years after the events of the first Top Gun. Tom Cruise steps into this role effortlessly, and supported by a cast which is both cliché and endearing. Arrogant guy, chip on shoulder guy, takes-no-crap girl, goofy/nervous guy… but before you can start an eye roll, you find yourself rooting for these characters.

Cinematography, visual effects, practical effects all marry with such precision the resulting visuals are nothing short of breathtaking. The training sequence through the simulated route and dog fights give us a glimpse of what is to come. Combine this scintillating action with high stakes, impeccable acting and an absolute-gut punch of nostalgia, this film warrants multiple viewings. The sound design is remarkable. Both at the cinema and at home with a Dolby Atmos capable sound system, this film roars to life from all around you, and even overhead. If you caught this film in 4D – how good was it!

This film feels like the old Hollywood blockbusters where there’s a goal with some history/character arc, and the goal is ultimately achieved with struggle and growth along the way. Dialogue and chemistry between characters feels natural and real, which ground the otherwise the over-the-top plot.

Top Gun: Maverick is simple storytelling that doesn’t deconstruct established characters or lore, and that allows newcomers to earn their place."
7,CoolBR,"Jun 11, 2023","A good movie with a remarkable story and good action scenes also represents the dogfights well.

But, honestly, the movie lacks depth. The enemy country in the movie isn't even cited in the name. Worse yet, there aren't any named enemies, which is a shame, even if the enemy country is wrong it would be good to know why they are fighting for, instead they choose to burn a lot of screentime for a melodramatic relationship between the protagonist and one of his students/comrade (Rooster)."
1,JackEFlaps,"Jun 4, 2023","Awful.  Bland characters and nonsense script. The Rooster storyline was absurd.  Call backs every scene.  Tom Cruise was lame and awkward. I loved the original, but this movie is the worst I've seen in awhile."
7,BasilZero,"Jun 4, 2023",Not as good as the first Top Gun. A lot of the plot is pretty much a recycled re-telling except the main character is a instructor instead of a student. The new characters were not as memorable as the original cast of characters. The action scenes were nicely done however the ending act was just laughable and kind of makes you wish it was not included. It was so forced and felt like it would have been better if they did not have that last part of the movie.
9,o1nk,"Jun 1, 2023","Отличное кино!
Если рассмотривать как отдлеьное произведение, не оглядываясь на прошлые части, хотя связь с ними велика, то также все отлично.
Динамика, звук, картинка, стальные птички и небо.
Сюжет - он здесь не главное. Превозмогай, усердно трудись, не думай - все получится!
Пересмотрю еще через год-два."
2,Tiger_X,"Jun 1, 2023","Top Gun peaks in the very first scene wherein Maverick takes a cutting edge jet/spaceship to record breaking speed. We never see this awesome jet again or the intensity of this scene repeated. The entire rest of the movie features slow outdated airplanes in an attempt to save money and help the studio cash-in on nostalgia.

The supporting cast is almost as listless as Iceman's cameo. They rehash the entire Goose story in a really weird way with his son, Rooster! Finally, they tack on a new Maverick romance for no apparent reason (but to include the ""Labyrinth girl"") that is cringe and goes nowhere. Every single joke falls flat and the dog fights are not as realistic as the first movie.

Bottom line: Would never watch this movie again past scene #1 but I've watched the original Top Gun movie a dozen times."
10,nikTerry,"May 26, 2023","Dear Hollywood This is how you make a movie, great action, great writing, likeable but flawed characters, and not political pandering, just a whole lot of fun . A must see, a sequel done right, fan service done right."
10,fanimator,"May 14, 2023","Absolute masterpiece of a film, loved it from beginning to end. Best movie ever."
10,A13jandro,"May 4, 2023","ESTA PELICULA SE SINTIO COMO REGRESAR AL PASADO CUANDO SE HACIAN LAS PELICULAS CON MAS CARIÑO QUE CON EFECTOS ESPECIALIES . UNA JOYA, Y EL AUDIO UFF ."
8,Ralfbergs,"May 2, 2023",This was good and certainly more action and entertainment scenes than first one - still I understand why first one was cult classic since for those times it was unseen. I enjoyed it.
10,alerikanderson,"Apr 25, 2023",Top Gun Maverick is everything right about what a movie should be and is one of the best movies ever made.
10,Thor1001,"Apr 18, 2023","I was expecting it to be a bad movie because it was a sequel released more than thirty years after the first top gun and because Hollywood only lives on slot machines these days, but after watching the movie I recognize that it is one of the best movies of recent years."
8,LetsTalkStuff,"Apr 17, 2023",Damn good movie ass movie. No bs no annoying muh message. Just kick ass fighter pilot hijinks.
4,strangebrew123,"Mar 30, 2023",Predictable nonsense! Virtually no story of merit. Very poor script written by a ten year old? The only redeeming feature was the ability of the next generation plane to about turn on a sixpence. Don't bother wasting your time.
10,BlueGuyTalks,"Mar 30, 2023","The Top Gun franchise may be a bit older and more cliché than other films, but Top Gun: Maverick’s witty delivery and sublime action sequences make it a film worth watching in the forthcoming years.

FULL REVIEW HERE: ****/the-blue-critic/post/top-gun-maverick-2022"
7,tonyGreen,"Mar 11, 2023","The plot and cast of characters is a almost a beat-for-beat remake of the first film in parts. There is completely superfluous romance, unlike in the first film where it was a key plot point.
This film definitely caters to in a large part to the audience of the 1985 film 'Top Gun'. The score reuses a lot of the original film's score, definitely a lot of nostalgia smuggled in. Some of this comes across as slightly ludicrous. For example Iceman, sorry *Hangman*, is a big fan of Foghat and their 1975 hit ""Slow Ride"".

But the film stands out for it's great aerial action sequences, they really are spectacular, and the conflict and pressure around those really lifts the sense of peril for the characters.

The (unidentified) foreign nuclear program is destroyed, American Exceptionlism triumphs against the odds, A shining city on the hill etc. Good fun, especially the second reel."
3,lessacebola,"Mar 9, 2023","Top Gun: Maverick é um filme com inúmeros clichês, além disso, sua trama não foi interessante o suficiente para me agradar."
10,TheKingRyan,"Feb 26, 2023","Top Gun Maverick is an incredible film, the best film of 2022 and certainly one of the best action films of recent decades, photography, editing, sound and spectacular action scenes, Steven Spielberg is right Tom Cruise saved cinema."
0,xgamrx365,"Feb 21, 2023","This movie has a terrible script, horrible acting, and a woefully predictable outcome."
9,jlittle1404,"Feb 15, 2023","I’m not a big tom cruise fan but I respect his work. I saw the first top gun years ago and remember just a little. I have to admit though this was clean family fun and a feel good movie for this year that gets ppl back in theaters. My family and I enjoyed it so much! Great movie for my generation my parents, kids, and grandparents all."
0,Chrismackechnie,"Feb 14, 2023","I'll admit that I never cared for the first film, but after all the hype around this one, I decided to see it. It's about as formulaic as a movie can be. And it really wasn't much different than the original."
8,Jim222001,"Feb 6, 2023","A rare unnecessary sequel that might actually be better than the original. The first is known for being sexy and macho. With some fine action but the movie was always missing something.
The enemy jets just would show up out of nowhere pretty much was one flaw. Top Gun: Maverick is as sexy and macho. However, it’s story is better than the original and it’s just a better made movie.
When the enemy jets show up it’s just not out of nowhere and it makes sense. The movie could have turned into Behind Enemy Lines. I am grateful it doesn’t though since this is a fighter jet movie after all.
Tom Cruise and Miles Teller make a surprisingly good team. That brings back good memories of Maverick and Goose and it gets to you emotionally."
10,Zack2013,"Feb 5, 2023","O filme é incrível a história é simples mas que funciona perfeitamente, já quando se trata de fotografia o Claudio Miranda fez um trabalho incrível, a trilha sonora e músicas originais são marcantes, a edição de Eddie Hamilton é provavelmente a melhor edição de 2022 ! , Joseph Kosinski foi o diretor perfeito, os personagens têm personalidade é fácil lembrar de Rooster, Hangman, já as cenas de ação são incríveis e Tom Cruise mais uma vez prova que é realmente a última estrela de cinema."
6,JeBjBo,"Feb 1, 2023","a LOT of fan service but HOLY **** THOSE FLIGHT SEQUENCES

it's essentially a remake of Top Gun 1986"
10,StevenD,"Jan 20, 2023","One of the best movies of the year.
As someone who wasn't a big fan of the original and didn't expect much considering that its success was largely due to hitting at the right time I half expected this movie to be OK, but nothing more.
I was so surprised leaving the cinema to find myself excited enough to scream. Movies like this don't come every month, most of the time they don't even come every year or even decade.
I won't spoil the movie in any way since it's worth it to see it first hand but if your only thought is if it's worth the ticket there's nothing more to say that buy one and get ready for a great experience."
3,artguy1,"Jan 17, 2023","Lots of manufactured high-tech tension in the air, rote and hollow relationships on the ground."
0,Wally242,"Jan 15, 2023","Trite, completely predictable and when did Cruise become Yoda?  Blah, blah and blah."
6,SugarDickDaddy,"Jan 13, 2023","Entertaining? Yes. Good movie? No. It IS NOT Academy material, nor Academy performances, because people ""liked"" it. It received 2.5 Stars in 1986 and this is 100% a ""remake"". It is, Maverick grows up and acts responsible with a forced diversity cast. The rest of the movie is the same from cliched scenes to identical dialogue. Academy for cinematography, sure. A fun movie, yes. Best Movie/Actor? Come On!!"
9,fluffyhatmagic,"Jan 12, 2023","Pretty much the perfect summer popcorn blockbuster. Don’t really remember what happened and gained no insight into the human condition, but it was very fun watching the planes go vroooom."
8,mikesgold2K,"Jan 11, 2023","Niby to ta sama konstrukcja opowieści co w oryginale ale jednak nadal wciąga niemiłosiernie, bawi, wzrusza, podbudowuje. Samoloty robią ziuuum i jest w pytę"
5,Achaern,"Jan 11, 2023","It's a rare time an audience is so willfully disrespected by the writers of the film. To suggest there is no longer any need for even the smallest amount of context for who the bad guy is suggests this is really just about American Exceptionalism. ""It's right when we do it!"". The entire story pretext centres around murdering scientists, despite the movie not being about anything more than showboating airplanes. Maverick is a shallow, shallow character we never needed to revisit. This needs literally 10 more minutes in the writing room to make sense. The action sequences were well shot but so dumb, especially the Mach 10 sequence at the start where the movie jumped the shark right away. This could have been a *great* movie if Tom was never in the cockpit and essentially played the role Ed Harris briefly did right at the start. Did not like. Do not recommend. 5/10 for the movie making, 0/10 for the writing/story."
0,MarkoD,"Jan 9, 2023","Wow, they literally copy paste first movie, so BAD! Worst acting, worst directing, worst writing i have ever seen"
10,Orazio,"Jan 8, 2023",Goooooooooooooooooooooooooooooooooooooooooooooooooooooooooooooooooooooooooooooood
10,supermalik987,"Jan 7, 2023",There only a few movie deserves the 10/10 and top gun is one of them . Since COVID most movie went to streaming or it's in computers for short amount of time then goes to streaming quickly. Four months this was in Cinema . If choose to see this in standard and not Imax or Dolby but mostly IMax . What are doing to self.
10,Aravghostthised,"Jan 7, 2023","I love this film. The action is amazing, better than the first one.likeable characters. It's an amazing story and hit-songs to good with it. Must recommend"
4,diegoserena,"Jan 6, 2023","Only the scene with the planes, which are outstanding. This sequel is really poor"
8,AnActorExplains,"Jan 5, 2023","There is very little to be said about Top Gun: Maverick; that’s because it’s as close to flawless as a Hollywood production can get: Exhilarating cinematography, excellent audio both in fore and in background, premiere acting, a vibrant palette of colors in varied locations, and, most importantly, impeccable writing the likes of which we rarely see in this soulless, sellout era of film and television.

This movie has an incredibly diverse cast, with all the accompanying bells and whistles, and without any of the conceited, self-serving pretense of modern woke culture.  Top Gun: Maverick presents the argument that any man, woman or person of color is capable of excellence without sacrificing plot, contriving script, or assassinating character. It does so without any need to present the female in the guise of a male in order to elevate her, and without the need to crucify the male lead in order to satisfy a resentful audience.                                                                                                                                                                             What is most admirable about this movie is how it delivers on incredibly human themes that are vital, now more than ever before, to our current culture. Screen writers Ehren Kruger, Eric Warren Singer, and Christopher McQuarrie seamlessly present extremely important themes such as selflessness, confidence, how to take a woman’s breath away, and how to create enduring friendships forged in competition. It even dares to present Commander “Iceman” Kazansky in a rather female light, as a patient, supportive, and compassionate authority. Take that, intersectionality! Family members of the enlisted will appreciate how director Joseph Kosinski does his very best to relay the incredible depth of feeling and emotion that is saying goodbye to a loved one that is headed into battle. All of this while developing a flawed protagonist who struggles to overcome his demons and deliver the best man he can be.                                                                        ""Top Gun: Maverick"" is a true hero story, the likes of which we grew up on, and one that will inspire endless generations to come."
8,carlossolrac,"Dec 29, 2022","Tom Cruise is a god. Just agree and watch this. His character arc is flatter than the earth but wow cool flying scenes. Also, man o war, what country were they fighting? Are we too scared of PC culture that we don't have enemies anymore? Loved it."
9,busiek,"Dec 29, 2022","I'm not great fan of this kind films, but I just watched it: no lectures, just entertainment. And I like it! Probably best film 2022."
10,kendrastuck,"Dec 29, 2022",Best movie I have ever seen! They did such an amazing job at portraying what it was like to be a real life fighter pilot! A lot of effort was put into this movie when the actors were actually in the planes and it wasn’t a green screen effect. Truly a masterpiece.
10,Mobileum,"Dec 28, 2022",That's exactly the type of movie I like. Really good photography. No SJW stupidity. Just compelling to watch. I'm really not a fan of movie these days but if all looked like that I would become a cinephile.
