score,author,date,review
8,Pixel_65,"Aug 29, 2022",Outstanding. Great cast. Amazing flight sequences. Action. Humour. Sadness. Love. Just a great blockbuster movie…
9,PepeSilviaMorb,"Aug 29, 2022","Favorite part of this move is when Tom Cruise looks at Miles Teller and goes ‘Looks like you’re Top Gun now’ and they both Maverick all over everybody. Masterpiece

(All jokes aside though this movie rocks)"
8,Musuh,"Aug 28, 2022","Nothing special, still a vety entertaining movie. Dialoges are sometimes a bit flat, and story non existing, the film is still interesting and thrilling! How it does it, i dont know... :D"
4,Torretta,"Aug 28, 2022",전작 안 봤으면 오글거리는 오마주밖에 없는 졸작 그 이상도 그 이하도 아님.
9,rpjmeta,"Aug 28, 2022",Ótimo filme. Sem lacração e agenda progressista. Ótimo filme. Sem lacração e agenda progressista.
8,JonoFitz,"Aug 28, 2022","Great movie, especially if you liked the first one. Other than a few cheesy bits which is expected from a Top Gun movie it's a good watch."
6,grimsfield,"Aug 27, 2022","This movie just isn't as good as its hyped up to be. The first movie was better, and as unrealistic as that was, this is far more ridiculous. If you can get past the mountain of plot holes though, and the overly simple  rinse and repeat story, you'll probably enjoy this. All in all this felt akin to what home alone 2 did for home alone 1. Same basic story of the first movie, just reskinned.

oh and the Jenifer Connolly / tom cruise, totally superficial romance plotline came off like a cialis commercial."
8,kenedy11,"Aug 27, 2022",É uma aula de cinema comparado com muito filmes e series que vemos hoje. Me prendeu do inicio até o fim.
9,nicorzF1,"Aug 27, 2022",The perfect sequel for such a classic. It seems that not always 'second parts aren't ever good' happens.
9,gracjanski,"Aug 26, 2022","The very good ratings are not fakes. The movie is very good:
It is not only about action, the beautiful pictures especially the wide angle perspectives from the jets and the support from Pentagon with military aircraft. Tom Cruise is perfect and his character is well written. Also I like the critics about the hierarchy in the military, that was great.
The only thing I didnt like? Of course this movie is very political correct (""strong women"" in the beginning -.- ) and US propaganda (of course USA is allowed to bomb enemy nuclear **** problem). And some of the scenes resembled too much to the first Top Gun. In the beginning I was even thinking if I downloaded the right movie, lol. Anyways in my view this Top Gun is even better than the first one."
9,rspecial1,"Aug 26, 2022","Best movie I've seen in recent times,  Congratulations! Just a lot of fun with lots of nostalgic nods to the original. Tom Cruise is spectacular!!"
5,snorkiss,"Aug 26, 2022","I feel the NEED! The NEED for a better sequel! - After hearing all the rave reviews I must admit to being a little bewildered, this is one of the dumbest films I've ever seen?! Just because it's not woke doesn't mean it's good. The script and acting are both nearly as terrible as Tom's hair dye. They should make a Top Gun Three-Some and bring back Meg Ryan and Kelly McGillis  - 5 stars for the admittedly great flying footage that for some reason reminded me of Star Wars?"
9,sce2aux,"Aug 26, 2022",xxxxxxxxxxxxxxxxxxxxxxxxxxxxxxxxxxxxxxxxxxxxxxxxxxxxxxxxxxxxxxxxxxxxxxxxxxxxxxxxxxxxxxxxxxxxxxxxxxxxxxxxxxxxxxxxxxxxxxxxxxxxxxxxxxxxxxxxxxxxxxxx
10,Amiam,"Aug 25, 2022","Most people focus on the action, the jets, the technology, the adrenaline of the flight sequences, but this movie is truly, and authentically only about thing: Relationships.  From Iceman's ""You have to let go"" to the ""Don't think"" lines, the inner core of this movie's soul is about how we as human beings navigate pain, loss, friendships, and brotherhood. And ultimately, how....despite it all, we must continue living past the pain of death and loss. THIS is why this movie is beautiful. THIS is why you can hear a pindrop while you watch it. THIS is why."
10,Cosmix,"Aug 25, 2022","This is probably the best sequel ever made.
I'd even say it was better than the original.
I absolutely loved it and I don't have any idea why some of the ""official"" critics have scored it low."
1,Broyax,"Aug 25, 2022","Voici la suite ou une espèce de suite du vieux film imbécile des années 80 au cours duquel Tom Bouse et ses talonnettes sévissaient déjà et excellaient en matière de prétention prétentieuse ! et d’ailleurs, lorsqu’il vient donner des leçons aux nouveaux **** cons de chez ‘Top Gun’, l’école d’élite, ceux-là sont carrément bluffés, estomaqués par autant de prétention… ils n’en reviennent pas !… et pourtant, Dieu sait qu’ils sont cons ! oui, le bon Dieu le sait, car tout cela nous dépasse.

Car en effet, encore un film à la gloire de Tom Bouse et en l’occurrence de son personnage de pilote de chasse sur le retour, qui sait tout et fait tout mieux que personne… pour une mission que l’on dirait tout droit sortie de Star Wars, le tout premier… sauf qu’on a remplacé les X-Wing par des F-18…!

Oui, ça en dit long sur le niveau de connerie, de beauferie, de ridicule du film entier avec en prime des passages psycho-dramatiques à la petite semaine, aussi grotesques que pathétiques. Et ridicules. Car so on peut résumer ce film en un mot, ce sera encore et toujours celui-ci, du début à la fin : ridicule ! ri-di-cule, putain de ridicule !

Du reste, tout n’y est pas entièrement mauvais et la réalisation est agréable, ni cut, ni move, juste normale. Et spectaculaire via des effets spéciaux évidemment au top. C’est Top Gun après tout malgré des longueurs regrettables soit dit en passant. Mais tout à fait fidèle au premier film, c’est un fait. Quant à dire lequel est le pire… je ne m’avancerais pas. J’hésite encore."
7,Simon32,"Aug 24, 2022",A fun movie and defiantly a step up from the original. But I think it has been overrated a little bit as it was very predictable and some of the characters were too cheesy. A solid 7/10
8,atnukov,"Aug 24, 2022",[SPOILER ALERT: This review contains spoilers.]
10,turdlemckay,"Aug 24, 2022",Epic. Amazing. I've seen it more than once and still want to see it again. Its better than I expected.
10,ozymandias79,"Aug 24, 2022","What did I just see? A movie respecting established characters. In the woke version, Maverick is a broken hobo called back to teach a team of lesbians who are already perfect in every way and teach him not to be a pathetic loser."
9,liamexe,"Aug 24, 2022","This is what you want from your entertainment—funny material to watch, without any BS or forced politics.

One of the few movies in recent memory that genuinely kept me on the edge of my seat in the theatre, the action was great with either no or very little cgi."
10,JetL,"Aug 24, 2022","Best movie in the nearest decade. Everything is perfect. The script,bgms,songs,conflicts between **** makes your jaws drop down every single second during this film. I went into the cinema with a normal state of mind. It is incredible to make a teenager to love this film with just two hours. I have never watched top gun(1986)before. This is a movie that everyone an fully enjoy and take a rollercoaster ride with Tom Cruise."
7,UncleWillard,"Aug 23, 2022","A solid sequel to the original with very few surprises. Lacked some of the charm of the original, but upped the ante on the flying action."
10,dshadowalker,"Aug 23, 2022","One of the best cinema experience in years, It went into my top movie list."
10,Voodoo123,"Aug 23, 2022",The fantastic cinematography and cast come together in a rare moment in which a sequel released so long after the original surpasses it so convincingly. Somehow it feels like anime levels of team bonding cheesiness mixed with military aircraft erotica and yet somehow it works for me. Very entertaining in an 80's cheesy way. Also as noted by several other reviews it's great to watch a film that isn't charged with the woke political garbage that has plagued all of Hollywood lately.
10,scho22,"Aug 23, 2022","My life movie: full of action, humour and a touching story behind  Well made indeed. Leaves a lingering message that will shock me always: past is past, time to let go ️   Never regret, and move towards the future"
10,FelipePedro07,"Aug 23, 2022",Awesome!!!!!!!!!!!!!!!!!!!!!!!!!!!!!!!!!!!!!!!!!!!!!!!111!!!!!!!!!!!!!!!!!!
10,caungardh,"Aug 23, 2022",Actual good fun movie in 2022!!! Is this the real life? Is this just fantasy?
10,vgmkyle,"Aug 22, 2022","The King of Kings. Proof you can make a film without jumping on some politically, woke soap-box. It's a thrilling film with a cast that is talented before anything else. Refreshing."
3,poolie1000,"Aug 20, 2022","tacky, boring, horribly acted, annoying, we left half way, couldn't stand it anymore"
10,ZacharyJohnston,"Aug 20, 2022","Flawless masterpiece. See it in the theater. Great sound design and music, all the acting in top notch."
10,Masemola,"Aug 20, 2022","The storyline is great, and the action kept me on the edge of my seat. It is my best movie of 2022 so far."
9,Hossamhassan,"Aug 19, 2022","بمناسبة نزوله علي النت .. كلام عن top gun maverick من غير حرق .. توم كروز

الفيلم بيبتدي مع الكابتن الطيار ماڤريك .. المخضرم صاحب السجل العبقري و الأوسمة العجوز اللي برغم سنه الكبير لا زال طيار ومترقاش لإنه شايف إنه في مكانه الطبيعي الوحيد .. علي عكس رؤية العالم كله .. وتشاء الظروف وتنسبله مهمة خطيرة وحتمية وصعبة وهي السبيل الوحيد عشان يكمل في مكانه ومفيش مجال لرفضها .. ولكن طبيعة مكانه في المهمة جديدة عليه ومش حاببها  وأصبح مسئول عن ناس كتير معاه منهم ناس بتمثل خيوط الماضي اللي افتكرها بعدت عنه للأبد .. فيا تري ايه اللي هيحصل ؟

يحسب للفيلم إنه بالرغم إنه واخد كتير اوي من الجزء الأول ومتمسك بيه لآخر فصل ومشهد وباني عليه الدوافع والتحديات الرئيسية لبطلنا وكل مراحل الفيلم الحاسمة ولكنه محافظ علي نفسه بالكامل كفيلم مستقل .. اه الفيلم جزء تاني صريح للجزء الأول القديم جدآ عكس ما توقعت .. وباني علي أحداث الجزء ده ومستعين بيها في لحظات كفلاش باك كمان .. ولكن قدرته الدرامية علي تسكين اللي قلته ده كله حلوة اوي ومتحسسكش إنك مسقط حاجة لو مشفتش الجزء الأول شبهي كده .. الفيلم عاطفي في المقام الأول .. وراس ماله هو مدي الشحن والطاقة اللي بيصدرهالك سواء تعاطف أو حب أو خوف أو توتر أو فرحة .. والمشاعر ديه والمشاهد اللي الفيلم استهلكها عشان ده يتحقق لو مأثرتش فيك الفيلم ملهوش طعم .. مع الأخذ في الإعتبار إننا في فيلم أكشن بطله توم كروز .. يعني لازم كل اللي قلته ده يكون وسط مشاهد اكشن طويلة ومليان طبقات وجهد ذهني وبدني .. مليانة تفاصيل عن الطيران كتيرة ولكنها لازمة وفي وقتها وسهل فهمها ومفيش اي حاجة اتقالت مش فعالة بل بالعكس تحس إنك عايز نفهم أكتر .. تعليقي الوحيد بس هو إني حسيت إن الفيلم بيزرع بعض اللحظات الحلوة جدآ ولكن غرضها هو أنها تشحت مشاعري بالعافية عشان تقوي النقلة للفصل اللي هيبدأ بعدها .. اه ده مكانش حلو  وحسيته كزا مرة.. بس الفيلم بيكافئك كل مرة بيعمل فيها ده .. وكل الممثلين اللي في المهمة كويسين اوي بس في اللي تم استغلاله وفي اللي كان مجرد عدد زيادة يخدم الدراما وتحس الفيلم مش لاقيلهم حاجة يعملوها .. فهما دائماً معانا علي الشاشة بس بروحهم .. لا بيحركوا الأحداث ولا مهمين في أي وقت وفي النهاية اللي شايف إن توم كروز مش ممثل علي الأقل يشوف بعض مشاهده الفردية والثنائية في الفيلم ده .. تحديداً مشاهد تفاعله مع ذكرياته أو الناس اللي ابتعد عنها وقابلها تاني فجأة .. Maverick فيلم مهم وقوي ومميز في تاريخ توم كروز .. علي مستوي الأكشن وده كان متوقع وفعلاً في شغل مبهر .. ولكن المفاجأة هي المستوي التمثيلي والتحديات اللي قصاد توم كروز .. الشخصية مش معقدة وأبعادها مش عميقة اوي ولكنها لها أبعاد ومن لحم ودم وعنده ما يكفي لإثبات كل شئ في صفه .. وطبعاً فيلم مهم جداً في تاريخ أفلام الطيران الحربي والمعارك الجوية"
8,cyberdoor,"Aug 19, 2022","I would say, give it a shot. It worths a ticket to see this movie in the cinema."
9,piotrek_kali,"Aug 18, 2022","Well deserved nine. Everything clicked. Plenty of nostalgia, easter eggs. I'm glad that both I and friend of mine spent four dollars (each) to watch and enjoy through two hours. It is a must seen movie."
9,emistar,"Aug 18, 2022",A blockbuster that sets itself apart from all disappointment from Hollywood this year...absolutely a **** political **** social agenda...just a perfect piece of what we want from Hollywood..
7,Muchachos_Dude,"Aug 17, 2022","Very good, better then the first top gun in my opinion. Cheesy, fun action."
10,Caitlin12,"Aug 15, 2022","1 of the greatest movie of the year, was so amazing i have seen it twice already
it was better than the original a good cinematic experience"
10,Signal1,"Aug 15, 2022","It was refreshing watching a movie that did not contain cartoon (CGI) action. The attention to detail in every aspect of the production, separates this from the vast majority of action movies made it the last twenty years."
9,SuperCurry30,"Aug 15, 2022",It seems that the concentration I had when watching Marvel movies when I was a teenager has come back to life while watching Top Gun: Maverick
6,argentshard,"Aug 11, 2022","Blatant propaganda film, and the actual mission is just a retreaded Star Wars Death Star assault, but still handled fairly well.

I appreciate that they continue the tradition of not identifying the antagonist faction/OPFOR, and actually got to fly the jets thanks to Cruise's demands.

The only cons I have with it are that it's a bit of a nostalgia trip, they think F/A-16s can somehow compete against SU-35s. (You are horribly mistaken if you think this is the case), and that once again America thinks they are liberator and goes to unnamed country to bomb them because ""they aren't allowed their own nuclear deterrence""...

but sure, good propaganda film."
10,Wizzle,"Aug 11, 2022","This is an inspiring and well acted movie. It has action, romance, great acting, and good writing. It is consistent with the first movie and brings back Val Kilmer in a good role."
10,valkyre,"Aug 11, 2022","This movie didnt have to be this good… most people would say that it SHOULDNT be this good… But thank the heavens it is THIS GOOD!

An extraordinary cinematic experience and of the absolute best sequels of all time. Thank you Tom Cruise for the relentless pursuit of cinematic splendor and for respecting my hard earned money."
10,P51MUSTANG03,"Aug 10, 2022","This movie is the definition of what a sequel should be. the flying/dogfighting is immersive as hell, the characters are fun and unique, Maverick's struggle to move on from the past, Rooster's conflict with himself and Maverick, and the dogfight. loved it. this is the best aviation film in years."
9,bignoisedoyle,"Aug 10, 2022","This was one of my best cinematic experiences and thank you for that. I'm not a huge fan of this kind of action movie, but it delivers, entertains and gives the audience what they want."
10,calopsitabased,"Aug 9, 2022",MElhor filme do ano. Valeu cada centavo ver no cinema. Chupa predador. Tom Cruise Chad Supremo
9,Chubbs19,"Aug 8, 2022","Best film I've seen all year!! The camera shots inside the cockpit thoughout the film were, for me, the best part of it all."
8,MattyIce34,"Aug 8, 2022","I wanna go fast! (Miles Teller was dragging, not my tempo) Probably the best legacy sequel we’ve gotten, obviously miles ahead of likes of Jurassic World Dominion."
10,Daniel_San,"Aug 8, 2022",Pure soul. It takes everything an action movie needs and lifts it up to the sky.
8,Axeface,"Aug 6, 2022","Good movie, not a masterpiece because of the reliance on nostalgia - but good non-the-less. I will probably never watch it again, which makes my 8 pretty generous."
10,Killandkillary,"Aug 6, 2022","In a cultural landscape (or should I say WOKESCAPE) that tries to tell us that we should be happy when our wives (notice I didn’t say EX-wives— divorce isn’t in the stinkin’ Bible, Veronica! You ain’t getting rid of me that easily!) announce that “that was the last straw” and leave us and take the kids just because we may have thrown a cast iron skillet full of hot oil at the tv when BRANDON’S big stupid I HATE HIM I HATE HIM UGLY FACE appeared on the screen, it’s good to know that REAL movies can still be made! I think today’s world would be a lot better if we as a nation internalized this film’s message about how it’s heroic and patriotic and cool when the military uses billion dollar jets to kill people for reasons that are unclear to the average citizen but make perfect sense once you realize we oughta put our faith into our military leaders. This country just doesn’t make sense to me anymore. I love America but I don’t live in America anymore this is WOKEMERICA and I can’t take it! I didn’t know the oil splashed on the boy, Ronnie! Maybe that’s your fault for letting him sit too close to the tv! I don’t give a hoot if I was supposed to be watching him because I’ve been unemployed for four years and you needed to go back to work so we could eat! It’s your job to watch the children! That’s what a wife does! I’d rather we’d have all starved than have faced the emasculation of you being the breadwinner! And now I hear you’re dating Elliot (or should I say WOKE-liot or Elli-WOKE) who is gonna spend time with MY SON and turn my boy into a little WOKE SJW WOKE MONSTER SJW WOKE WOKE WOKE SJW WOKE WOKE WOKE WOKE WOKE WOKE SJWSJWSJW!!!!!!!!!!!!!!!!’mnmnnn and the jet scenes were so cool can you believe those were all practical effects!?!?"
1,bbmd2,"Aug 5, 2022","This movie was slow and predictable. Bad script, with short sentences and small words, delivered badly. A total propaganda piece to drum up support for our over priced military. The only thing lacking was a sound track of our most patriotic songs sung by Toby Keith."
6,dpatacao,"Aug 5, 2022",[SPOILER ALERT: This review contains spoilers.]
10,TheGreatNikakis,"Aug 4, 2022","Top Gun:Maverick was the best cinematic experience in years. An incredible achievement thanks to the dedication of the cast and crew, this movie offers the best flying sequences ever seen. The aerial combat scenes are amazing as is Tom Cruise as Maverick, in one of his greatest roles. I highly recommend this movie for all action movie fans."
6,jorgeguti1,"Aug 3, 2022",Not a bad film but in my opinion is overrated. Good acting but the plot is nothing special.
8,Jcondic,"Aug 3, 2022","TOP GUN:MAVERICK is just another reason why Tom Cruise is the last big budget movie star left. This is a film that needs to be seen on the big screen, the plane fight scenes are amazing. Cruise is his typical good self but it’s the supporting cast that helps bring the film to life, Jennifer Connelly, Miles Teller and specifically Glen Powell. I felt like some of the Iceman stuff felt shoved in, and the last act might’ve played it too safe, but other than that the film is pure popcorn entertainment."
10,Wandsberg,"Aug 2, 2022",[SPOILER ALERT: This review contains spoilers.]
9,GamingT2009,"Jul 31, 2022","My god was this movie amazing honestly, I am a token away from how amazing it was. I think what really gets me when it comes to this movie, was that its visuals look amazing, it looks stunning. I also feel like the plot itself was great as well, I know a lot of people dislike it, but I think it was really great, I'll be it a little simple. But this movie was just another experience that I will never forget."
10,Aol1015,"Jul 30, 2022",[SPOILER ALERT: This review contains spoilers.]
10,Youwantacookie1,"Jul 30, 2022","Please go watch it in cinemas before it's gone, a movie like this deservers to be watched on the big screen!"
10,Captainj99,"Jul 29, 2022","I had no expectations going into this movie. Glad I didn't because it was great, so good it was exciting and brought back the love of the first movie again."
9,brendenmp1,"Jul 29, 2022","If someone watched the original top gun and asked ""what would i want from a top gun sequel?"" this has everything you'd have wanted. Great stuff. a must see in the theaters."
10,Nunes86,"Jul 23, 2022","Esse filme é fenomenal, nós últimos anos literalmente desanimei de assistir filmes pois deixaram o entretenimento pra levantar bandeira das agendas, deixaram o entretenimento pra fazer lacração. Mas o Tom Cruise não se vendeu a agenda e fez o melhor filme da carreira dele, fazia muito tempo que não via um filme me deixava feliz."
8,MarkHReviews,"Jul 23, 2022","“Top Gun: Maverick” is an exhilarating film with no pretensions.  It just wants to be a first-rate diversion on a hot, humid summer afternoon.  By that measure, it exceeds expectations.  If you’re looking for an existential assessment of the human condition, go see “Everything Everywhere All at Once.”  If you want to examine the nature and texture of relationships, check out “Brian and Charles” or “Marcel the Shell with Shoes On.”  “Maverick” is an unapologetic adrenaline rush that doesn’t have time to probe the darker corners of the human psyche.  So just sit back and savor Tom Cruise reprising his most iconic role.

This film works for three reasons: its visuals, its tone and what happens when there aren’t jets in the air.  Visually, “Maverick” is simply spectacular.  The dogfights and other aerial shots are all real, not CGI.  When you see the g-forces pressing on Tom Cruise’s face, that’s real.  This commitment to reality makes these action scenes even more riveting.

The tone of the film is equally skilled.  It’s self-referential without being self-absorbed.  There’s a bar where there are renditions of “Great Balls of Fire.”  There is beach football substituting for beach volleyball.  The admiral’s daughter (referenced in the original but never seen) shows up.  Most of all, there’s an appearance by Val Kilmer, who played fighter pilot “Iceman” in the original.  Here, he’s an admiral whose body is failing because of cancer.  He can speak only with great effort.  (In real life, Kilmer has battled throat cancer.  His brief speaking parts in “Maverick” are computer-generated.)

Finally, in “Maverick” the story keeps its footing even when it’s on the ground.  The original film was littered with excruciating dialogue filled with tortured clichés (“Your ego is writing checks your body can’t cash.”).  And because of Director Tony Scott’s advertising background, “Top Gun” featured way too many locker room scenes that just looked like product placement for Jockey briefs. By comparison, “Maverick” offers a cornucopia of interesting tidbits.  There’s a height-appropriate love interest for Cruise. (Jennifer Connelly is excellent.)  There’s also a surrogate father-son dynamic between Maverick and Goose’s son.  As a special bonus, Maverick appears incrementally more self-aware.  There’s even a female fighter pilot vying to become the gender-neutral alpha dog.

The plot is almost an afterthought.  After taking an experimental aircraft to Mach 10 in an opening scene, Maverick is assigned back to Top Gun School to train pilots for a suicide mission.  An unidentified rogue nation is engaging in uranium enrichment.  Maverick has to train pilots who will blow up the enrichment plant before this country can develop nuclear capability that will threaten civilization.  And so on.

A storyline that can be charitably described as “implausible” in no way detracts from the fun of this film.  In one of the three (count ‘em, three) climactic scenes, Maverick and his team attack the rogue nation, a country with plentiful evergreen trees and snow on the ground.  The uranium enrichment facility is three minutes from the coast.  Go to the biggest screen you can find to watch Tom Cruise bomb Norway."
